{
    "title": "Gedanken Versichert",
    "description": "",
    "sections": [
        {
            "title": "Mathematik",
            "links": [
                {
                    "title": "Primzahl-Test - von Botond",
                    "url": "/programs/prime-test/"
                }
            ],
            "sections": []
        },
        {
            "title": "Physik",
            "links": [
                {
                    "title": "Bewegung eines Balles - von Bendegúz & Botond",
                    "url": "/programs/parabola-motion/"
                },
                {
                    "title": "Newtonsche Gravitation - von Bendegúz",
                    "url": "/programs/newtonsche-gravitation/"
                },
                {
                    "title": "Two-body simulation using Verlet Integration - von Bendegúz & Botond",
                    "url": "/programs/two-body-simulation/"
                }
            ],
            "sections": []
        },
        {
            "title": "Programmierung",
            "links": [
                {
                    "title": "Vortex-Graphik - von Bendegúz",
                    "url": "/programs/random-points/"
                }
            ],
            "sections": []
        }
    ],
    "touchWarning": "WARNUNG: Diese Programme funktionieren nicht mit Touchscreens"
}